<?xml version="1.0" encoding="UTF-8"?>
<alps
        xmlns:xsi="http://www.w3.org/2001/XMLSchema-instance"
        xsi:noNamespaceSchemaLocation="https://alps-io.github.io/schemas/alps.xsd">
    <title>オンライン書店</title>
    <doc>オンライン書店のカタログ管理と購入フローを定義するALPSプロファイル。RESTful APIとUIの両方に対応するセマンティック定義を提供します。</doc>
    <link href="https://github.com/example/online-bookstore-api/issues" rel="issue"/>

    <!-- オントロジー -->
    <descriptor id="id" def="https://schema.org/identifier" title="識別子" tag="core">
        <doc>各リソースの一意な識別子。UUIDまたは自動生成の整数。</doc>
    </descriptor>
    <descriptor id="title" def="https://schema.org/name" title="タイトル" tag="catalog">
        <doc>書籍のタイトルまたはカテゴリ名。最大200文字の文字列。</doc>
    </descriptor>
    <descriptor id="author" def="https://schema.org/author" title="著者" tag="catalog">
        <doc>書籍の著者名。複数著者の場合はカンマ区切り。</doc>
    </descriptor>
    <descriptor id="isbn" def="https://schema.org/isbn" title="ISBN" tag="catalog">
        <doc>国際標準図書番号。ISBN-13形式、ハイフン区切り。</doc>
    </descriptor>
    <descriptor id="price" def="https://schema.org/price" title="価格" tag="commerce">
        <doc>書籍の販売価格。税抜き金額（日本円）。</doc>
    </descriptor>
    <descriptor id="category" def="https://schema.org/category" title="カテゴリ" tag="catalog">
        <doc>書籍のジャンルまたはカテゴリ。複数カテゴリに所属可能。</doc>
    </descriptor>
    <descriptor id="quantity" def="https://schema.org/quantityValue" title="数量" tag="commerce">
        <doc>カート内の書籍数量。1以上の整数値。</doc>
    </descriptor>
    <descriptor id="totalAmount" def="https://schema.org/totalPrice" title="合計金額" tag="commerce">
        <doc>注文またはカート内容の合計金額。税込み表示。</doc>
    </descriptor>
    <descriptor id="userName" def="https://schema.org/name" title="顧客名" tag="customer">
        <doc>顧客の氏名。姓と名をスペースで区切り。</doc>
    </descriptor>
    <descriptor id="userEmail" def="https://schema.org/email" title="メールアドレス" tag="customer">
        <doc>顧客の連絡先メールアドレス。注文確認メールの送信に使用。</doc>
    </descriptor>
    <descriptor id="shippingAddress" def="https://schema.org/address" title="配送先住所" tag="shipping">
        <doc>商品の配送先住所。郵便番号、都道府県、市区町村、番地、建物名を含む。</doc>
    </descriptor>
    <descriptor id="paymentMethod" def="https://schema.org/paymentMethod" title="支払い方法" tag="payment">
        <doc>注文の支払い方法。クレジットカード、代金引換、銀行振込など。</doc>
    </descriptor>
    <descriptor id="query" title="検索キーワード" tag="catalog">
        <doc>書籍検索に使用するキーワードまたは条件。タイトル、著者名、ISBNなどで検索可能。</doc>
    </descriptor>

    <!-- タクソノミー -->
    <descriptor id="Home" def="https://schema.org/WebPage" title="ホーム画面" tag="navigation">
        <doc>アプリケーションの起点。サイト全体のナビゲーションとプロモーション情報を表示。</doc>
        <descriptor href="#goToCatalog"/>
        <descriptor href="#goToCart"/>
    </descriptor>

    <descriptor id="Catalog" def="https://schema.org/CollectionPage" title="書籍カタログ" tag="catalog">
        <doc>全書籍を表示する画面。カテゴリ絞り込み、キーワード検索、並び替え機能を提供。デフォルトは新着順。</doc>
        <descriptor href="#goListBooks"/>
        <descriptor href="#goSearchBooks"/>
        <descriptor href="#goGetCategories"/>
        <descriptor href="#goToBookDetails"/>
        <descriptor href="#goToCategory"/>
        <descriptor href="#goToCart"/>
        <descriptor href="#Book"/>
    </descriptor>

    <descriptor id="Book" def="https://schema.org/Book" title="書籍" tag="catalog">
        <doc>個別の書籍情報を表示する画面。詳細情報、レビュー、関連書籍を表示。この画面からカートに追加可能。</doc>
        <descriptor href="#id"/>
        <descriptor href="#title"/>
        <descriptor href="#author"/>
        <descriptor href="#isbn"/>
        <descriptor href="#price"/>
        <descriptor href="#category"/>
        <descriptor href="#doAddToCart"/>
        <descriptor href="#goToCatalog"/>
    </descriptor>

    <descriptor id="Category" def="https://schema.org/Category" title="カテゴリ" tag="catalog">
        <doc>書籍のジャンル分類。親子関係を持つ階層構造が可能。</doc>
        <descriptor href="#id"/>
        <descriptor href="#title"/>
        <descriptor href="#goToCatalog"/>
        <descriptor href="#goToBookDetails"/>
    </descriptor>

    <descriptor id="ShoppingCart" def="https://schema.org/ShoppingCart" title="ショッピングカート" tag="cart">
        <doc>購入予定の書籍を入れるカート。数量変更、削除、合計金額確認が可能。セッション単位で管理。</doc>
        <descriptor href="#totalAmount"/>
        <descriptor href="#goListCartItems"/>
        <descriptor href="#doUpdateQuantity"/>
        <descriptor href="#doRemoveFromCart"/>
        <descriptor href="#goToCheckout"/>
        <descriptor href="#goToCatalog"/>
    </descriptor>

    <descriptor id="Checkout" title="購入手続き画面" tag="checkout">
        <doc>購入手続き画面。顧客情報、配送先の入力を行い、支払いに進む。注文確定前の最終確認を表示。</doc>
        <descriptor href="#doUserInfo"/>
        <descriptor href="#doShippingInfo"/>
        <descriptor href="#goToPayment"/>
        <descriptor href="#goToCart"/>
    </descriptor>

    <descriptor id="Payment" title="支払い画面" tag="payment">
        <doc>支払い情報の入力、注文の確定、注文完了情報の表示を行う画面。支払い方法の選択、決済処理、注文確定を処理し、完了時に注文番号、合計金額、配達予定日を表示。確認メールは自動送信。</doc>
        <descriptor href="#paymentMethod"/>
        <descriptor href="#doPaymentInfo"/>
        <descriptor href="#doPlaceOrder"/>
        <descriptor href="#goOrderDetails"/>
        <descriptor href="#goToHome"/>
        <descriptor href="#goToCart"/>
    </descriptor>

    <!-- コレオグラフィー -->
    <descriptor id="goToHome" type="safe" rt="#Home" title="ホーム画面へ">
        <doc>アプリケーションのホーム画面に遷移。どの画面からもアクセス可能。</doc>
    </descriptor>
    <descriptor id="goToCatalog" type="safe" rt="#Catalog" title="カタログ画面へ">
        <doc>書籍カタログ一覧画面に遷移。全書籍が表示される。</doc>
    </descriptor>
    <descriptor id="goToBookDetails" type="safe" rt="#Book" title="書籍詳細画面へ">
        <doc>選択した書籍の詳細情報画面に遷移。書籍IDの指定が必要。</doc>
        <descriptor href="#id"/>
    </descriptor>
    <descriptor id="goToCart" type="safe" rt="#ShoppingCart" title="カート画面へ">
        <doc>現在のショッピングカートの内容を表示する画面に遷移。</doc>
    </descriptor>
    <descriptor id="goToCheckout" type="safe" rt="#Checkout" title="購入手続き画面へ">
        <doc>カート内容を確認し購入手続きに進む画面に遷移。カートが空の場合は遷移不可。</doc>
    </descriptor>
    <descriptor id="goToPayment" type="safe" rt="#Payment" title="支払い画面へ">
        <doc>支払い情報を入力し注文を確定する画面に遷移。</doc>
    </descriptor>

    <descriptor id="goListBooks" type="safe" rt="#Catalog" rel="collection" title="書籍一覧取得" tag="catalog">
        <doc>カタログ内の全書籍の一覧を取得。ページネーション（デフォルト20件/ページ）と並び順（新着順、価格順、人気順など）の指定が可能。</doc>
    </descriptor>
    <descriptor id="goSearchBooks" type="safe" rt="#Catalog" rel="collection" title="書籍検索" tag="catalog">
        <doc>指定した検索キーワードに基づいて書籍を検索。タイトル、著者名、内容説明、ISBNなど複数フィールドを横断検索可能。</doc>
        <descriptor href="#query"/>
    </descriptor>
    <descriptor id="goGetCategories" type="safe" rt="#Catalog" rel="collection" title="カテゴリ一覧取得" tag="catalog">
        <doc>利用可能な全書籍カテゴリの一覧を取得。階層カテゴリの場合は親子関係も返却。</doc>
    </descriptor>
    <descriptor id="goToCategory" type="safe" rt="#Category" title="カテゴリ画面へ" tag="catalog">
        <doc>選択したカテゴリで絞り込まれた書籍を表示するカテゴリ詳細画面に遷移。</doc>
        <descriptor href="#id"/>
    </descriptor>

    <descriptor id="doAddToCart" type="unsafe" rt="#ShoppingCart" rel="collection" title="カートに追加" tag="cart">
        <doc>指定した書籍をショッピングカートに追加。既にカート内にある場合は数量を増加。在庫を超える注文はエラー。</doc>
        <descriptor href="#id"/>
        <descriptor href="#quantity"/>
    </descriptor>
    <descriptor id="goListCartItems" type="safe" rt="#ShoppingCart" rel="collection" title="カート内商品一覧取得" tag="cart">
        <doc>現在のショッピングカート内の全商品を取得。数量、小計、合計金額を含む。</doc>
    </descriptor>
    <descriptor id="doUpdateQuantity" type="idempotent" rt="#ShoppingCart" title="カート内数量変更" tag="cart">
        <doc>カート内の特定商品の数量を変更。0以下の値は指定不可。在庫を超える数量はエラー。</doc>
        <descriptor href="#id"/>
        <descriptor href="#quantity"/>
    </descriptor>
    <descriptor id="doRemoveFromCart" type="idempotent" rt="#ShoppingCart" title="カートから削除" tag="cart">
        <doc>指定した商品をカートから完全に削除。カート内に存在しない場合は変更なし。</doc>
        <descriptor href="#id"/>
    </descriptor>

    <descriptor id="doUserInfo" type="unsafe" rt="#Checkout" title="顧客情報入力" tag="customer">
        <doc>顧客の氏名とメールアドレスを入力。メールアドレスは正規表現でバリデーション。</doc>
        <descriptor href="#userName"/>
        <descriptor href="#userEmail"/>
    </descriptor>
    <descriptor id="doShippingInfo" type="unsafe" rt="#Checkout" title="配送情報入力" tag="shipping">
        <doc>商品の配送先住所を入力。郵便番号による住所自動入力機能あり。</doc>
        <descriptor href="#shippingAddress"/>
    </descriptor>
    <descriptor id="doPaymentInfo" type="unsafe" rt="#Payment" title="支払い情報入力" tag="payment">
        <doc>注文の支払い方法を選択し、必要な決済情報を入力。クレジットカード選択時はカード情報を入力しバリデーション。</doc>
        <descriptor href="#paymentMethod"/>
    </descriptor>
    <descriptor id="doPlaceOrder" type="unsafe" rt="#Payment" title="注文確定" tag="order">
        <doc>入力情報に基づき注文を確定し、決済処理を行い、支払い画面に注文確認情報を表示。決済実行、在庫確保、確認メール送信を行う。この操作は取り消し不可。</doc>
    </descriptor>

    <descriptor id="goOrderDetails" type="safe" rt="#Payment" title="注文詳細表示" tag="order">
        <doc>確定した注文の詳細情報を支払い画面に表示。注文番号、購入商品一覧、合計金額、配送先、支払い方法などを含む。</doc>
    </descriptor>
</alps>
